product,description,ad,category
Cat Tree,"A multi-level cat tree with platforms, scratching posts, and hiding spots.","Give your cat the ultimate playground with our Cat Tree – multi-level, sturdy, and perfect for climbing and scratching. Shop now and keep your cat entertained for hours!",pets
Outdoor Patio Set,A durable and stylish set of chairs and a table designed for outdoor relaxation and entertaining.,Enjoy the outdoors with our Outdoor Patio Set – perfect for sunny days and cozy evenings!,furniture
Decorative Room Dividers,Beautiful and functional dividers that create separate spaces while adding a decorative element to your room.,Define your space with our Decorative Room Dividers – style and functionality in one!,furniture
Turquoise Statement Ring,"A bold ring featuring a vibrant turquoise stone, perfect for making a statement.",Make a bold statement with our Turquoise Statement Ring – a vibrant and eye-catching piece that adds a pop of color to your look. Shop now and stand out!,jewelry
Silicone Baking Cups,"Reusable and non-stick baking cups, perfect for muffins, cupcakes, and other baked goods.",Bake smarter with our Silicone Baking Cups – eco-friendly and easy to clean!,kitchen
Off-road Jeep,A rugged and capable off-road vehicle designed to conquer any terrain with ease.,Explore the unbeaten path with our Off-road Jeep – adventure awaits!,cars
Building Blocks Set,"A classic set of colorful blocks that encourage creativity, problem-solving, and fine motor skills.","Build, create, and imagine with our Building Blocks Set – endless possibilities in every block!",toys
Garden Tiller,A powerful tiller for preparing soil and planting beds.,"Prepare your garden beds with our Garden Tiller – powerful, easy to use, and perfect for breaking up soil. Shop now and get your garden ready for planting!",garden
Dining Bench,"A long, sturdy bench that provides additional seating at your dining table, perfect for family gatherings.",Gather around with our Dining Bench – stylish seating for everyone!,furniture
Adhesives and Sealants,Strong adhesives and sealants for bonding and sealing materials.,"Bond and seal with our Adhesives and Sealants – strong, reliable, and perfect for all your construction needs. Shop now and ensure a lasting bond!",construction
Garden Kneeler,A padded kneeler and seat for comfortable gardening.,"Garden in comfort with our Garden Kneeler – padded, versatile, and perfect for long gardening sessions. Shop now and take care of your knees!",garden
Musical Instrument Set,"A set of child-friendly musical instruments, including drums, xylophone, and maracas, to inspire young musicians.","Let the music play with our Musical Instrument Set – rhythm, fun, and creativity in every note!",toys
BMW 3 Series,A luxury sedan car with a sporty design advanced technology and a smooth driving experience.,Elevate your drive with the ultimate luxury sports sedan.,cars
Potato Masher,A sturdy masher for making smooth mashed potatoes and other dishes.,"Create creamy mashed potatoes with our Potato Masher – durable, easy to use, and perfect for all your mashing needs. Shop now and elevate your side dishes!",kitchen
Car Charger,A fast-charging USB adapter for powering your devices on the go.,"Stay powered on the road with our Car Charger – fast, reliable, and perfect for all your devices. Shop now and never run out of battery!",automotive
Plant-Based Protein Shake,"A delicious and nutritious shake made from plant-based proteins, perfect for post-workout recovery or a quick meal.","Fuel your body with our Plant-Based Protein Shake – powerful nutrition, plant-powered goodness!",food
Makeup Brush Set,A complete set of high-quality brushes for flawless makeup application.,"Achieve a flawless look with our Makeup Brush Set – soft, durable, and perfect for every step of your makeup routine. Shop now and elevate your beauty game!",makeup
Gaming Laptop,A powerful laptop designed for gaming with high-performance hardware.,"Game on the go with our Gaming Laptop – powerful, portable, and perfect for all your favorite titles. Shop now and take your games anywhere!",gaming
Convertible Coffee Table,A multifunctional coffee table that can be adjusted to different heights and configurations.,Transform your living space with our Convertible Coffee Table – versatility at its best!,furniture
Writing Desk,A compact and stylish desk designed for writing and studying.,"Create your perfect writing space with our Writing Desk – compact, stylish, and perfect for all your writing and studying needs. Shop now and inspire your creativity!",writing
Windowpane-check shirt," A shirt featuring a large, grid-like pattern resembling windowpanes.","Discover timeless sophistication with our Windowpane-check Shirt. 🚫🙂 Made from high-quality fabric, its grid-like pattern ensures effortless style for both. 🛍️ Get yours now and redefine your wardrobe!",clothes
Air Freshener,A long-lasting freshener for keeping your home smelling fresh and clean.,"Enjoy a fresh home with our Air Freshener – long-lasting, pleasant, and perfect for any room. Shop now and make your home smell wonderful!",cleaning
Floral-print dress," A dress featuring a delicate, feminine floral pattern.","Introducing our Floral-Print Dress: Delicate & feminine, this beautifully crafted piece is perfect for any occasion. Experience style in full bloom now. #Fashion #FloralDress 🌸👗✨",clothes
Kitchen Scale,A digital scale for precise measurement of ingredients.,Measure with precision using our Kitchen Scale – essential for baking and cooking. Perfect for creating delicious recipes every time!,kitchen
Double-breasted blazer," A jacket featuring two parallel rows of buttons, creating a sophisticated, polished look.","Refine your style with our elegant double-breasted blazer - boasting two parallel rows of buttons, sophistication and polish await. Transform your wardrobe today! #FashionUpgrade #SophisticatedLook",clothes
Photo Scanner,"A device that digitizes your old photos, preserving them for future generations.",Preserve the past with our Photo Scanner – digitize your memories with ease!,electronics
Indoor Plants,"Lush, low-maintenance plants that bring a touch of nature and freshness to your living room.",Bring life to your space with our Indoor Plants – natural beauty for your home!,furniture
Makeup Brush Cleaner,A gentle cleaner for keeping your makeup brushes hygienic and soft.,"Keep your brushes clean with our Makeup Brush Cleaner – gentle, effective, and perfect for maintaining hygiene. Shop now and extend the life of your brushes!",makeup
Gourmet Chocolate Truffles,"Luxurious, handcrafted truffles with rich, creamy centers and a variety of decadent coatings.",Indulge in luxury with our Gourmet Chocolate Truffles – a bite of pure bliss!,food
Zipper-detail jeans," Jeans featuring zipper accents or closures, adding an edgy and modern touch.","Upgrade your denim game! Introducing Zipper-detail Jeans - where style meets edge. Make a bold statement with added zipper accents & closures. Get yours today, stand out in the crowd.",clothes
Faux fur vest," A sleeveless, fur-like garment, adding warmth and texture to any outfit.",Upgrade your wardrobe with a touch of luxury! Our Faux Fur Vest is the perfect sleeveless addition for style & warmth. Make a statement in any outfit - Get yours now! #StayStylishAndWarm,clothes
Embellished pumps," High-heeled shoes adorned with crystals, beads, or other ornate details.","Elevate your style to dazzling heights with our Embellished Pumps! Adorned with exquisite crystals & beads, these high-heels are the epitome of elegance. Step into glamour today!",clothes
Electric Stand Mixer,"A powerful and versatile mixer for baking and cooking, with multiple attachments for various tasks.","Mix, knead, and whip with our Electric Stand Mixer – your ultimate kitchen companion",kitchen
Cycling Helmet,A lightweight and aerodynamic helmet designed for safety and comfort during cycling.,Ride safe and stylish with our Cycling Helmet – protection meets performance!,sport
Sand,High-quality sand for mixing concrete and mortar.,"Mix with precision using our Sand – high-quality, consistent, and perfect for concrete and mortar. Shop now and ensure a strong mix!",construction
Makeup Mirror,A lighted mirror with adjustable brightness for perfect makeup application.,"See every detail with our Makeup Mirror – adjustable lighting, portable, and perfect for flawless makeup application. Shop now and light up your beauty routine!",makeup
Bar Cabinet,": A stylish cabinet designed to store and display your drinks and glassware, perfect for entertaining.","Entertain with flair using our Bar Cabinet – your home bar, beautifully organized!",furniture
Smartwatch,"A wearable device that tracks fitness, monitors health, and keeps you connected with notifications on your wrist.","Stay ahead with our Smartwatch – your health, your time, your style!",electronics
Wrap dress," A dress with a front closure formed by folding one side over the other and tying at the waist, creating a flattering, adjustable shape.","Discover our stylish Wrap Dress - the perfect blend of fashion and function! With its adjustable front closure and figure-flattering waist tie, you'll feel confident and chic all day long. Get yours today!",clothes
Memory Card,A high-capacity storage card for saving your photos and videos with fast transfer speeds.,Store more memories with our Memory Card – reliable and fast!,electronics
Cosmetic Bag,A stylish and spacious bag for organizing your makeup and skincare products.,"Keep your beauty essentials organized with our Cosmetic Bag – stylish, spacious, and perfect for travel or everyday use. Shop now and carry your makeup in style!",makeup
Garden Gloves,Comfortable and durable gloves for protecting your hands while gardening.,"Protect your hands with our Garden Gloves – comfortable, durable, and perfect for all gardening tasks. Shop now and garden with confidence!",garden
Eyebrow Kit,A complete kit with tools and products for shaping and defining eyebrows.,"Define your brows with our Eyebrow Kit – complete, easy to use, and perfect for creating the perfect arch. Shop now and frame your face beautifully!",makeup
Glass Food Storage Containers,"Durable and eco-friendly containers for storing leftovers, meal prepping, and organizing your kitchen.","Store and organize with our Glass Food Storage Containers – fresh, safe, and sustainable!",kitchen
Platform heels," Shoes with a raised sole and heel, offering height and comfort.",Step up your style game with our chic Platform Heels 👠! Boost your height & confidence while experiencing ultimate comfort. Walk tall & turn heads. Shop now! Limited stock & free shipping.,clothes
Fishing Gloves,Durable and comfortable gloves for handling fish and gear.,"Protect your hands with our Fishing Gloves – durable, comfortable, and perfect for handling fish and gear. Shop now and fish with confidence!",fishing
Drywall Sheets,Lightweight and easy-to-install drywall sheets for interior walls and ceilings.,"Finish your interiors with our Drywall Sheets – lightweight, easy to install, and perfect for smooth walls and ceilings. Shop now and create a polished look!",construction
Medical Gloves,"Disposable gloves made from latex or nitrile, providing protection and hygiene for medical procedures.",Stay protected with our Medical Gloves – essential for safety and hygiene!,health
Stainless Steel Colander,"A durable colander for draining pasta, vegetables, and more.","Drain with ease using our Stainless Steel Colander – sturdy, easy to clean, and perfect for all your kitchen needs. A must-have for every home cook!",kitchen
Garden Shed,A durable and spacious shed for storing tools and equipment.,"Organize your garden tools with our Garden Shed – durable, spacious, and perfect for all your storage needs. Shop now and keep your garden tidy!",garden
Diamond Tennis Bracelet,A luxurious bracelet featuring a continuous line of sparkling diamonds.,Shine bright with our Diamond Tennis Bracelet – a timeless piece that exudes luxury and elegance. Perfect for special occasions or everyday glamour. Shop now!,jewelry
Area Rugs,Soft and stylish rugs that add warmth and texture to your floors.,Anchor your space with a rug that ties the room together.,furniture
Henley shirt," A collarless, button-up shirt with a small placket, offering a casual yet stylish look.","Discover timeless style & unbeatable comfort with our Henley shirts! Casual meets chic in these collarless, button-up wonders. Elevate your wardrobe - Shop now! Limited stock.",clothes
Layered Chain Necklace,A trendy necklace featuring multiple delicate chains for a layered look.,Stay on-trend with our Layered Chain Necklace – the perfect accessory to add depth and style to any outfit. Layer up and elevate your look today!,jewelry
Mop and Bucket Set,A complete set for mopping and cleaning floors.,"Make mopping easy with our Mop and Bucket Set – durable, efficient, and perfect for all floor types. Shop now and keep your floors sparkling!",cleaning
Organic Honey,"Pure, natural honey sourced from organic beehives, rich in flavor and packed with health benefits.","Sweeten your life the natural way with our Organic Honey – pure, golden goodness!",food
Daybed,"A versatile piece of furniture that serves as both a sofa and a bed, perfect for lounging or hosting guests.",Relax and unwind with our Daybed – comfort and versatility in one!,furniture
Fishing Rod,A high-quality fishing rod for various types of fishing.,"Catch more fish with our Fishing Rod – durable, versatile, and perfect for all your fishing adventures. Shop now and cast your line with confidence!",fishing
Smart Speaker with Voice Assistant,"A voice-activated speaker that plays music, answers questions, and controls smart home devices.","Your voice, your command – enjoy seamless control with our Smart Speaker!",electronics
Broom,A sturdy broom for sweeping floors and outdoor areas.,"Sweep away dirt with our Broom – sturdy, efficient, and perfect for indoor and outdoor use. Shop now and keep your spaces clean!",cleaning
Chef's Knife Set,"A high-quality set of knives designed for precision cutting, slicing, and dicing.","Slice like a pro with our Chef's Knife Set – sharp, reliable, and essential for every kitchen!",kitchen
4K Smart TV,"A high-definition television with smart features, offering stunning visuals and access to endless entertainment.","Experience the ultimate viewing with our 4K Smart TV – crystal-clear visuals, endless entertainment!",electronics
Portable Camping Stove,A compact and efficient stove for cooking meals while camping.,"Cook delicious meals in the wild with our Portable Camping Stove – compact, easy to use, and perfect for any outdoor adventure. Shop now and elevate your camping experience!",camping
Wireless Earbuds,Compact and wireless earbuds offering high-quality sound and noise cancellation for on-the-go listening.,Cut the cords and elevate your sound with our Wireless Earbuds – freedom meets premium audio!,electronics
Velvet blazer," A luxurious, soft blazer made from velvet material, perfect for dressing up or down.","Introducing the Velvet Blazer - Luxurious, soft, and versatile. Elevate your style for any occasion. Experience sheer elegance in every wear. Get yours now and embrace ultimate sophistication.",clothes
Camouflage pants," Pants featuring the classic camouflage pattern, offering a bold, urban look.",Discover bold & urban style with our Classic Camouflage Pants🔥Elevate your wardrobe & stand out on every adventure🌆Low stock alert📢Shop NOW before they're gone! #CamouflagePants #OwnYourStyle,clothes
Bermuda shorts,Knee-length shorts that offer a polished and conservative option for warmer weather.,"Stay cool & stylish in our Bermuda shorts! Perfectly tailored, knee-length for a polished look. Upgrade your warm-weather wardrobe now! Visit our store, limited stock available.",clothes
Garnet Pendant Necklace,"A stunning necklace featuring a deep red garnet stone, perfect for adding a touch of drama.",Add a touch of drama to your look with our Garnet Pendant Necklace – a stunning piece that’s perfect for making a statement. Shop now and embrace the boldness!,jewelry
Cat Window Perch,A window-mounted perch for your cat to enjoy the view and sunlight.,"Give your cat the best seat in the house with our Cat Window Perch – sturdy, easy to install, and perfect for bird-watching. Shop now and let your cat enjoy the view!",pets
Blood Pressure Monitor,"An easy-to-use device for monitoring blood pressure at home, helping you keep track of your cardiovascular health.",Take control of your health with our Blood Pressure Monitor – precise and convenient!,health
All-Purpose Cleaner,A versatile cleaner for various surfaces in your home.,"Tackle any mess with our All-Purpose Cleaner – effective, versatile, and perfect for all your cleaning needs. Shop now and keep your home spotless!",cleaning
High-low dress," A dress with a hemline that is higher at the front and lower at the back, creating a dramatic, flowing effect.","Discover elegance with a twist in our stunning High-Low Dresses! Showcase your unique style with a hemline that rises at the front and falls at the back, making every step a showstopper. Shop now!",clothes
Bricks,Durable and uniform bricks for building walls and structures.,"Create sturdy structures with our Bricks – uniform, durable, and perfect for any construction project. Shop now and build with quality!",construction
Herb Scissors,Specialized scissors with multiple blades for quickly and efficiently chopping herbs.,"Chop herbs in seconds with our Herb Scissors – fast, easy, and efficient!",kitchen
Gold Bangle Set,A set of gold bangles that can be stacked or worn individually for a chic look.,"Stack up the style with our Gold Bangle Set – versatile, chic, and perfect for any occasion. Mix and match to create your unique look. Shop now!",jewelry
Ink Refills,Refill cartridges for fountain pens to keep your writing flowing.,"Keep your fountain pen ready with our Ink Refills – compatible, easy to use, and perfect for continuous writing. Shop now and never run out of ink!",writing
Egg Separator,A simple tool for separating egg yolks from whites.,Separate eggs effortlessly with our Egg Separator – perfect for baking and cooking. A must-have for every home chef!,kitchen
Vanilla Bean Macarons,"Delicate and airy macarons with a rich vanilla bean filling, perfect for a sophisticated treat.",Experience elegance with our Vanilla Bean Macarons – a taste of Paris in every bite!,food
Makeup Sponge,A versatile sponge for blending foundation and concealer seamlessly.,"Blend like a pro with our Makeup Sponge – soft, easy to use, and perfect for a flawless finish. Shop now and create a seamless look!",makeup
Car Emergency Kit,A comprehensive kit with tools and supplies for roadside emergencies.,"Be prepared for anything with our Car Emergency Kit – comprehensive, portable, and perfect for roadside emergencies. Shop now and drive with peace of mind!",automotive
Modular Shelving Unit,A customizable shelving system that can be arranged in various configurations to fit your space and needs.,Organize your way with our Modular Shelving Unit – flexibility and style in one!,furniture
Plaid shirt,A classic button-up shirt featuring a bold or subtle plaid pattern.,Upgrade your wardrobe! Discover our Classic Button-Up Plaid Shirt: bold or subtle patterns for versatile style. Elevate your fashion game. Shop now!,clothes
Compact Folding Desk,"A space-saving desk that folds away when not in use, perfect for small apartments or home offices.","Maximize your space with our Compact Folding Desk – work smart, live better!",furniture
Puzzle Set,"A collection of puzzles with varying difficulty levels, designed to challenge and entertain kids of all ages.",Piece together the fun with our Puzzle Set – where every challenge is a triumph!,toys
Baggie Jumpsuit,A one-piece baggy jumpsuit with a stylish and comfortable fit ideal for a bold streetwear statement.,Stand out in style with a baggy jumpsuit.,clothes
Sequined dress," A dress embellished with numerous sequins, providing sparkle and glamour.",Discover unparalleled sparkle & glamour with our new Sequined Dress! Turn heads and make unforgettable memories at your next event. Shop now for the ultimate show-stopping look!,clothes
Pet First Aid Kit,A comprehensive kit with essential supplies for pet emergencies.,"Be prepared for any situation with our Pet First Aid Kit – comprehensive, portable, and perfect for emergencies. Shop now and keep your pet safe!",pets
Oversized Baggie Hoodie,A super loose hoodie with a relaxed fit perfect for layering or wearing as a statement piece.,Stay cozy and stylish with the ultimate oversized hoodie.,clothes
Skinny jeans,Tight-fitting jeans that hug the legs and accentuate the figure.,Discover our top-selling Skinny Jeans – designed to sculpt your figure and flatter every curve! Upgrade your wardrobe with jeans that fit impeccably & offer lasting style. Shop now!,clothes
Headlamp,A hands-free light source for nighttime activities and emergencies.,"Keep your hands free with our Headlamp – bright, adjustable, and perfect for nighttime adventures. Shop now and light up your path!",camping
Bomber jacket," A short, durable jacket with a ribbed collar and cuffs, based on the classic military design.","Discover the perfect blend of style & durability! Get our Bomber Jacket - a classic military-inspired masterpiece, boasting a ribbed collar & cuffs for that extra edge. Upgrade your wardrobe now!",clothes
Holiday Throw Blanket,"A cozy and soft blanket with holiday patterns, perfect for snuggling up by the fire.",Stay warm and festive with our Holiday Throw Blanket – comfort and cheer in every thread!,holidays
Bodycon dress," A tight-fitting dress, highlighting curves and creating an ultra-sleek figure.","Introducing our Bodycon Dress! ✨ Flaunt your curves and make a bold statement in this ultra-sleek, figure-hugging masterpiece. Get ready to own the night! Shop now & turn heads. #SleekSensation 🛍️",clothes
Ballpoint Pen Set,A set of classic ballpoint pens for reliable and everyday writing.,"Write with confidence using our Ballpoint Pen Set – reliable, smooth, and perfect for everyday use. Shop now and enjoy effortless writing!",writing
Cleaning Caddy,A portable caddy for organizing and carrying cleaning supplies.,"Stay organized with our Cleaning Caddy – portable, spacious, and perfect for all your cleaning supplies. Shop now and make cleaning more efficient!",cleaning
Windows and Doors,Energy-efficient windows and doors for homes and buildings.,"Enhance your home with our Windows and Doors – energy-efficient, stylish, and perfect for any building. Shop now and improve your home's comfort and appearance!",construction
Karaoke Machine,A fun and easy-to-use machine that turns your living room into a karaoke stage.,Sing your heart out with our Karaoke Machine – the ultimate party starter!,electronics
Makeup Brush Holder,A stylish holder for keeping your makeup brushes organized and within reach.,"Organize your brushes with our Makeup Brush Holder – stylish, functional, and perfect for keeping your tools in place. Shop now and add a touch of elegance to your vanity!",makeup
Mandoline Slicer,A versatile slicer for cutting vegetables and fruits into perfect slices.,"Slice like a pro with our Mandoline Slicer – perfect for salads, garnishes, and more. Create restaurant-quality dishes at home!",kitchen
Cargo Joggers with Reflective Details,Stylish joggers with multiple pockets and reflective  combining functionality with a modern streetwear vibe.,"Functional, stylish, and ready for the streets – day or night.",clothes
Fishing Lures,A selection of lures designed to attract various types of fish.,"Attract more fish with our Fishing Lures – realistic, durable, and perfect for all fishing styles. Shop now and make your bait irresistible!",fishing
Gaming Desk,A spacious desk designed for gaming setups with cable management features.,Organize your gaming setup with our Gaming Desk – spacious,gaming
Photo Album,A beautifully designed album to store and display your cherished photos.,Preserve your memories with our Photo Album – timeless and elegant!,electronics
Reusable Hot/Cold Pack,"A versatile pack that can be heated or cooled to provide relief for pain, swelling, or muscle soreness.",Soothe your aches with our Reusable Hot/Cold Pack – comfort and relief whenever you need it!,health
Portable Record Player,A compact and stylish record player that lets you enjoy your vinyl collection anywhere.,"Rediscover vinyl with our Portable Record Player – classic sound, modern convenience!",electronics
Cooler Box,An insulated cooler for keeping food and drinks cold during camping trips.,"Keep your food and drinks fresh with our Cooler Box – insulated, durable, and perfect for long camping trips. Shop now and enjoy cold refreshments wherever you go!",camping
Carpet Cleaner,A powerful cleaner for removing stains and odors from carpets.,"Revive your carpets with our Carpet Cleaner – powerful, effective, and perfect for removing stains and odors. Shop now and enjoy fresh, clean carpets!",cleaning
Gold Hoop Earrings,Stylish and versatile gold hoops that add a touch of glamour to any outfit.,"Make a statement with our Gold Hoop Earrings – the perfect blend of style and versatility. Perfect for day or night, these hoops are a must-have!",jewelry
Hyundai Kona Electric,A compact electric SUV with a stylish design and impressive range.,Go green without compromising on style or performance.,cars
