product,description,ad,category
Toilet Brush,A sturdy brush for cleaning toilets and removing stains.,"Keep your toilet clean with our Toilet Brush – sturdy, effective, and perfect for removing stains. Shop now and maintain a fresh bathroom!",cleaning
Camping Shower,A portable shower for staying clean during extended camping trips.,"Stay fresh on your camping trips with our Camping Shower – portable, easy to use, and perfect for outdoor hygiene. Shop now and enjoy the comforts of home in the wild!",camping
Garden Hose,A durable and flexible hose for watering plants and cleaning outdoor spaces.,"Keep your garden lush with our Garden Hose – durable, kink-resistant, and perfect for all your watering needs. Shop now and make watering a breeze!",garden
Crystal Stud Earrings,"Elegant earrings featuring sparkling crystals, perfect for adding a touch of glamour.","Add a touch of sparkle to your look with our Crystal Stud Earrings – elegant, timeless, and perfect for any occasion. Shop now and shine bright!",jewelry
First Aid Kit,A comprehensive kit containing essential supplies for treating minor injuries and emergencies.,Be prepared for anything with our First Aid Kit – safety and peace of mind in one box!,health
Salted Caramel Chocolate Bar,A smooth milk chocolate bar filled with gooey salted caramel for the perfect sweet and salty combination.,"Satisfy your cravings with our Salted Caramel Chocolate Bar – sweet, salty, and oh-so-delicious!",food
High-waist jeans," Full-length jeans with a waistband that sits right at the natural waist, accentuating curves and elongating the legs.","Discover high-waist jeans, perfect for flattering your figure! Embrace your curves and enjoy longer-looking legs with these stylish full-length wardrobe essentials. Shop now for a confident stride.",clothes
Portable PA System,"A powerful and portable public address system, perfect for events, presentations, and outdoor gatherings.","Amplify your voice with our Portable PA System – clear, powerful sound wherever you go!",electronics
Nail Polish Organizer,A stylish organizer for storing and displaying your nail polish collection.,"Keep your nail polish collection organized with our Nail Polish Organizer – stylish, compact, and perfect for easy access. Shop now and add a pop of color to your space!",makeup
Statement Clock,A bold and artistic wall clock that serves as both a timepiece and a striking decorative element.,Make a statement with our Statement Clock – timekeeping with a touch of art!,furniture
Portable Toilet,A compact and hygienic toilet for camping in remote areas.,"Stay comfortable and hygienic with our Portable Toilet – compact, easy to use, and perfect for remote camping. Shop now and enjoy the convenience of a toilet anywhere!",camping
Crystal Chandelier Earrings,Glamorous earrings featuring cascading crystals for a dramatic and elegant look.,Step into the spotlight with our Crystal Chandelier Earrings – the ultimate accessory for adding drama and elegance to any outfit. Perfect for special occasions!,jewelry
Organic Granola,"A crunchy and nutritious blend of oats, nuts, and dried fruits, perfect for a healthy breakfast or snack.","Start your day right with our Organic Granola – wholesome, delicious, and energizing!",food
Zebra-print coat," A coat featuring a black and white striped pattern, emulating the appearance of zebra stripes.",Unleash your wild side with our stunning Zebra-print coat! Bold black & white stripes guarantee turning heads. Quality & flair in one stunning piece. Dare to be fierce! Limited stock. Get yours today.,clothes
Writing Light,A clip-on light for illuminating your writing area in low-light conditions.,"Write in any light with our Writing Light – adjustable, bright, and perfect for low-light conditions. Shop now and never strain your eyes again!",writing
Fringe skirt," A skirt featuring fringe detailing on the bottom, creating movement and fun.","Introducing our fabulous Fringe Skirt! Step out in style with eye-catching fringe detailing that adds flair and movement. Perfect for any occasion, create unforgettable memories with this chic piece.",clothes
Sofa Bed,A versatile sofa that transforms into a comfortable bed perfect for small spaces or guests.,Double the comfort with a sofa that becomes a bed.,furniture
Toyota Corolla Hybrid,A fuel-efficient hybrid car with a modern design and advanced safety features.,Save fuel and drive smarter with the Corolla Hybrid.,cars
Tassel earrings,Dangling earrings featuring a playful tassel of threads or beads.,"Discover elegance with a twist! Our Tassel Earrings, the perfect blend of fashionable threads & beads, elevate your style! Limited stock! Don't miss them! Shop now!",clothes
Tiles,"High-quality tiles for flooring, walls, and backsplashes.","Enhance your space with our Tiles – durable, stylish, and perfect for floors, walls, and backsplashes. Shop now and transform your home!",construction
Denim jacket," A classic, versatile jacket made from durable denim fabric.",Introducing our Classic Denim Jacket - Timeless style meets unbeatable durability! Perfect for any wardrobe. Upgrade yours & transform any outfit instantly. Get yours now! bit.ly/denim-jacket,clothes
Orthopedic Pillow,A specially designed pillow that supports proper spinal alignment and reduces neck pain.,Sleep better with our Orthopedic Pillow – comfort and support for a restful night!,health
One-shoulder top," A top that bares one shoulder, adding an asymmetrical and stylish element.","Discover the chic one-shoulder top that elevates your style effortlessly. Accentuate your allure with this asymmetrical marvel, showcasing both elegance and sophistication. Shop now and turn heads!",clothes
Car Phone Mount,A sturdy and adjustable mount for securing your phone while driving.,"Stay connected and safe with our Car Phone Mount – sturdy, adjustable, and perfect for hands-free navigation. Shop now and keep your eyes on the road!",electronics
Enamel Charm Bracelet,A playful bracelet featuring colorful enamel charms for a fun and trendy look.,Add a pop of color to your wrist with our Enamel Charm Bracelet – a fun and trendy accessory that’s perfect for expressing your unique style. Shop now and let your personality shine!,jewelry
Metal Sheets,"Durable metal sheets for roofing, siding, and construction.","Build with durability using our Metal Sheets – strong, weather-resistant, and perfect for roofing and siding. Shop now and protect your structures!",construction
High-Top Sneakers with Chunky Soles,Chunky high-top sneakers with bold color blocking designed to elevate any streetwear outfit.,Step up your streetwear game with bold chunky kicks.,clothes
Garden Sprinkler,An adjustable sprinkler for efficient watering of lawns and gardens.,"Water your lawn and garden with ease using our Garden Sprinkler – adjustable, efficient, and perfect for all your watering needs. Shop now and keep your garden green and healthy!",garden
Wireless Earbuds,"Compact, wireless earbuds offering high-quality sound and noise cancellation for an immersive audio experience.",Cut the cords and elevate your sound with our Wireless Earbuds – freedom meets premium audio!,electronics
Gaming Mouse Pad,"A large, smooth surface mouse pad with RGB lighting for precise control.","Enhance your precision with our Gaming Mouse Pad – large, smooth, and perfect for every gamer. Shop now and take control of your game!",gaming
Camo Print Utility Pants,Camouflage-print pants with utility pockets combining rugged style with streetwear functionality.,Blend in with the streets while standing out in style.,clothes
Pinafore dress," A sleeveless dress with an apron-style front, perfect for layering over a blouse or sweater.","Upgrade your wardrobe with our chic Pinafore Dress! Layer it over a blouse or sweater for a versatile, stylish look. Sleeveless, apron-style front - Perfect for any occasion! Shop now.",clothes
Console Charging Station,A station for charging multiple controllers and accessories simultaneously.,"Keep your controllers charged with our Console Charging Station – efficient, compact, and perfect for gamers. Shop now and never run out of power!",gaming
Emerald Cut Diamond Earrings,Elegant earrings featuring emerald-cut diamonds for a sophisticated and timeless look.,Experience timeless elegance with our Emerald Cut Diamond Earrings – a sophisticated addition to your jewelry collection. Perfect for special occasions or everyday luxury. Shop now!,jewelry
Photo Editing Software,Advanced software for editing and enhancing your photos with professional tools and effects.,Transform your photos with our Photo Editing Software – creativity at your fingertips!,electronics
Maxi dress," A floor-length dress offering a dramatic, elegant look, perfect for formal occasions or casual wear.","Discover elegance in every step with our Maxi Dress👗. Effortlessly stylish for casual or formal occasions, this floor-length stunner is perfect for turning heads👀 wherever you go! Upgrade your wardrobe now!",clothes
Pet Grooming Kit,"A complete kit with brushes, combs, and nail clippers for pet grooming.","Keep your pet looking their best with our Pet Grooming Kit – complete, easy to use, and perfect for all grooming needs. Shop now and pamper your pet!",pets
Cowl-neck sweater," A sweater featuring a draped, fold-over neckline, adding warmth and softness.","Stay cozy & stylish this season with our Cowl-neck Sweaters! Embrace elegance in a draped, fold-over neckline that keeps you warm & snug. Limited stock. Get yours now!",clothes
Pen Holder,A decorative holder to keep your pens and pencils within easy reach.,"Keep your pens and pencils handy with our Pen Holder – decorative, functional, and perfect for your desk. Shop now and add a touch of style to your workspace!",writing
Kitchen Shears,"Multi-purpose scissors designed for cutting herbs, meat, and packaging.","Cut through anything with our Kitchen Shears – versatile, sharp, and perfect for all your kitchen tasks. A must-have for every home chef!",kitchen
Caramel Popcorn,"Sweet and buttery caramel-coated popcorn, perfect for movie nights or snacking on the go.",Pop into sweetness with our Caramel Popcorn – the ultimate snack for any occasion!,food
Dog Raincoat,A waterproof raincoat to keep your dog dry during wet weather.,"Keep your dog dry with our Dog Raincoat – waterproof, adjustable, and perfect for rainy walks. Shop now and stay stylish in any weather!",pets
Storage Bed,A bed with built-in drawers or compartments for extra storage space.,Sleep and store in style with a bed that does it all.,furniture
Luxury King-Size Bed,"A spacious and luxurious bed with a plush mattress and elegant frame, ensuring a restful night’s sleep.",Sleep like royalty with our Luxury King-Size Bed – comfort and style combined!,furniture
Camping Axe,A sturdy axe for chopping wood and preparing campfires.,"Prepare your campfire with ease using our Camping Axe – sturdy, reliable, and perfect for chopping wood. Shop now and make your camping experience more enjoyable!",camping
Mini Crossbody Bag,A compact and stylish crossbody bag with adjustable straps and multiple pockets.,Carry your essentials in style with a mini crossbody bag.,clothes
Dog Bed,A comfortable and orthopedic bed for your dog's rest and relaxation.,"Give your dog the comfort they deserve with our Dog Bed – orthopedic, supportive, and perfect for a good night's sleep. Shop now and let your dog dream in comfort!",pets
Photo Lightbox,A portable lightbox that provides perfect lighting for photographing small objects and products.,Perfect your product shots with our Photo Lightbox – professional lighting made easy!,electronics
Tiered skirt," A skirt composed of multiple layers of fabric, creating a voluminous and eye-catching silhouette.","Discover elegance with our stunning Tiered Skirt! Designed with multiple layers of luxe fabric, this voluminous piece adds flair & style to any wardrobe. Elevate your look today - Shop Now!",clothes
Garden Trellis,A sturdy trellis for supporting climbing plants and vines.,"Support your climbing plants with our Garden Trellis – sturdy, durable, and perfect for creating vertical gardens. Shop now and add height to your garden!",garden
Halter-neck top,A sleeveless top with a high neckline that ties or fastens at the back of the neck.,Introducing our chic Halter-neck Top! Perfect for a sleek day-to-night look. High neckline meets elegant tie-back design. Limited stock - Grab yours now at [website]! Free shipping on orders $50+!,clothes
Disinfectant Wipes,Pre-moistened wipes for disinfecting surfaces and killing germs.,"Keep your home germ-free with our Disinfectant Wipes – effective, convenient, and perfect for all surfaces. Shop now and maintain a healthy environment!",cleaning
Cast Iron Skillet,"A heavy-duty skillet that provides even heat distribution, perfect for searing, frying, and baking.","Cook with tradition using our Cast Iron Skillet – durable, versatile, and timeless!",kitchen
Car Key Finder,A small device to help you locate your car keys quickly and easily.,"Never lose your keys again with our Car Key Finder – compact, easy to use, and perfect for quick location. Shop now and save time!",automotive
Decorative Wall Shelves,"Stylish and functional shelves to display books, plants, and decorative items, adding both storage and charm to your walls.",Organize and decorate with our Decorative Wall Shelves – a perfect blend of form and function!,furniture
Indoor Plants,Low-maintenance plants like succulents or monstera to bring life and freshness to your home.,Bring nature indoors with stylish and easy-to-care-for plants.,garden
Fishing Knife,A sharp and durable knife for cleaning and preparing your catch.,"Prepare your catch with our Fishing Knife – sharp, durable, and perfect for all your fishing needs. Shop now and make cleaning fish a breeze!",kitchen
Decorative Candle Holders,Elegant candle holders that add a warm and inviting ambiance to your living room.,Set the mood with our Decorative Candle Holders – light up your evenings in style!,furniture
Glass Cleaner,A streak-free cleaner for windows and mirrors.,"Achieve crystal-clear windows with our Glass Cleaner – streak-free, effective, and perfect for all glass surfaces. Shop now and enjoy a clear view!",cleaning
Non-Stick Frying Pan,"A durable and easy-to-clean frying pan with a non-stick surface, perfect for cooking a variety of dishes.","Cook with ease using our Non-Stick Frying Pan – perfect meals, every time!",kitchen
Geometric-print maxi skirt," A floor-length skirt featuring bold, angular patterns for a modern, artistic look.",Introducing our Geometric-print Maxi Skirt: A unique fusion of modern art & style! Be the trendsetter with our floor-length skirt featuring bold angular patterns. Shop now & flaunt your artistic side!,clothes
Dustpan and Brush Set,A sturdy set for sweeping and collecting debris.,"Sweep up messes with our Dustpan and Brush Set – sturdy, efficient, and perfect for quick cleanups. Shop now and keep your floors tidy!",cleaning
Kaftan," A flowy, loose-fitting garment with wide sleeves, often worn as a dress or beach cover-up.","Discover your new summer essential! Our stylish Kaftans are perfect as chic dresses or beach cover-ups, featuring wide sleeves & a breezy fit. Get yours now and stay fashionably cool!",clothes
Gaming Microphone,A high-quality microphone for clear voice chat and streaming.,"Communicate clearly with our Gaming Microphone – crisp, clear, and perfect for streaming and chatting. Shop now and let your voice be heard!",gaming
Photo Printer,A compact printer that produces high-quality photo prints from your digital images.,Bring your memories to life with our Photo Printer – vibrant prints at your fingertips!,electronics
Silver Pendant Necklace,A delicate silver necklace with a minimalist pendant for a subtle yet chic look.,Discover the beauty of simplicity with our Silver Pendant Necklace – a delicate touch to elevate your everyday style. Shop now and embrace understated elegance!,jewelry
Jacquard skirt," A fabric featuring a raised, woven design, creating an intricate and luxurious skirt.",Discover elegance in our luxurious Jacquard skirt! Adorned with a lavish raised woven design for an intricate & lavish style. Shop now & elevate your wardrobe instantly!,clothes
Dog Harness,A comfortable and adjustable harness for safe and secure walks.,"Walk your dog in comfort with our Dog Harness – adjustable, secure, and perfect for all sizes. Shop now and enjoy stress-free walks!",pets
Fishing Hat,A wide-brimmed hat for sun protection during long fishing trips.,"Protect yourself from the sun with our Fishing Hat – wide-brimmed, comfortable, and perfect for long days on the water. Shop now and stay safe under the sun!",fishing
Assorted Gummy Bears,"Chewy and flavorful gummy bears in a rainbow of fruity flavors, perfect for snacking.","Taste the rainbow with our Assorted Gummy Bears – fun, fruity, and irresistible!",food
Cast Iron Grill Pan,A heavy-duty grill pan that provides even heat distribution for perfect grilling.,"Grill like a pro with our Cast Iron Grill Pan – perfect for steaks, veggies, and more. Enjoy restaurant-quality meals at home!",kitchen
Car Roof Rack,"A sturdy rack for transporting bikes, skis, and other gear on your car's roof.","Transport your gear with our Car Roof Rack – sturdy, versatile, and perfect for all your outdoor adventures. Shop now and take your gear anywhere!",automotive
Decorative Throw Blankets,"Soft and cozy blankets in various textures and patterns, perfect for adding warmth and style to your sofa.",Snuggle in style with our Decorative Throw Blankets – comfort meets elegance!,furniture
Correction Tape,A clean and precise correction tape for fixing mistakes without a mess.,"Fix mistakes with ease using our Correction Tape – clean, precise, and perfect for neat corrections. Shop now and keep your writing flawless!",writing
Camping Lantern,A bright and energy-efficient lantern for lighting up your campsite.,"Light up your campsite with our Camping Lantern – bright, durable, and perfect for nighttime adventures. Shop now and never be left in the dark!",camping
Steel Rebar,Reinforcing steel bars for adding strength to concrete structures.,"Strengthen your concrete with our Steel Rebar – durable, reliable, and perfect for reinforcing structures. Shop now and ensure your construction stands the test of time!",construction
Modular Gaming Controller,"A fully customizable gaming controller with interchangeable components, allowing you to tailor it to your playstyle.",Build the ultimate controller for your ultimate gameplay.,gaming
Cooling Pad,A pad with built-in fans to keep your laptop cool during intense gaming sessions.,"Keep your laptop cool with our Cooling Pad – efficient, portable, and perfect for long gaming sessions. Shop now and prevent overheating!",gaming
Opal Drop Earrings,Elegant earrings featuring stunning opal stones that catch the light beautifully.,Turn heads with our Opal Drop Earrings – a stunning blend of elegance and sophistication. Perfect for adding a touch of glamour to any outfit. Shop now!,jewelry
Camping Tarp,A durable and waterproof tarp for shelter and ground cover.,"Stay dry and protected with our Camping Tarp – waterproof, durable, and perfect for creating extra shelter. Shop now and be prepared for any weather!",camping
LED Christmas Lights,Energy-efficient LED lights in various colors and patterns to brighten up your holiday decorations.,"Light up your holidays with our LED Christmas Lights – festive, bright, and eco-friendly!",holidays
Minimalist Dining Table,"A sleek and simple dining table made from high-quality materials, ideal for modern interiors.","Elevate your dining experience with our Minimalist Dining Table – where simplicity meets elegance!""",furniture
Holiday Wreath,"A beautifully crafted wreath made from evergreen branches, pinecones, and festive ornaments.",Welcome the season with our Holiday Wreath – a timeless symbol of holiday cheer!,holidays
Garden Bench,A comfortable and stylish bench for relaxing in your garden.,"Relax in your garden with our Garden Bench – comfortable, stylish, and perfect for enjoying your outdoor space. Shop now and create a cozy retreat!",garden
Portable Power Bank,"A compact device that charges your phone and other gadgets on the go, ensuring you never run out of battery.",Stay powered up anywhere with our Portable Power Bank – never miss a moment!,electronics
Gel Pen Set,A set of vibrant gel pens for colorful and smooth writing.,"Add color to your writing with our Gel Pen Set – smooth, vibrant, and perfect for all your creative projects. Shop now and let your ideas flow!",writing
Sheer blouse," A semi-transparent blouse, perfect for layering over a camisole or bralette.","Discover effortless elegance with our Sheer Blouse - semi-transparent, lightweight, perfect for layering. Pair with your favorite camisole or bralette for a chic look that makes a statement. Shop now!",clothes
Waders,Waterproof waders for staying dry while fishing in rivers and lakes.,"Stay dry and comfortable with our Waders – waterproof, durable, and perfect for all your fishing adventures. Shop now and wade into the water with confidence!",clothes
Gaming Mouse,A high-precision mouse designed for gaming with customizable buttons and RGB lighting.,"Dominate the game with our Gaming Mouse – high-precision, customizable, and perfect for every gamer. Shop now and take your gameplay to the next level!",gaming
Home Theater System,A complete audio system with multiple speakers and a subwoofer for a surround sound experience.,Bring the cinema home with our Home Theater System – immersive sound for every movie night!,electronics
Fishing Sunglasses,Polarized sunglasses for reducing glare and improving visibility on the water.,"See clearly on the water with our Fishing Sunglasses – polarized, durable, and perfect for reducing glare. Shop now and improve your fishing experience!",fishing
Remote-Controlled Car,"A fast and durable RC car with easy controls, perfect for indoor and outdoor play.","Race into action with our Remote-Controlled Car – speed, control, and excitement in your hands!",toys
Sweatshirt," A casual, pullover top made from soft fabric, often featuring a bold graphic or pattern.","Stay cozy and stylish with our soft, graphic sweatshirts! Perfect for laid-back days or making a bold statement. Shop now for your new wearable art top! Don't miss out! #SweatshirtLove",clothes
Slip dress," A simple, elegant dress, often with thin straps and a V-neck, reminiscent of lingerie.","Discover timeless elegance with our chic Slip Dress. Featuring delicate thin straps, a graceful V-neck, and a design inspired by lingerie. Exude confidence and style today. Shop Now!",clothes
Cold-Pressed Juice,"Fresh, nutrient-packed juice made from cold-pressed fruits and vegetables for maximum flavor and health benefits.",Refresh and recharge with our Cold-Pressed Juice – nature’s goodness in every sip!,food
Silicone Spatula Set,A set of heat-resistant silicone spatulas perfect for baking and cooking.,"Upgrade your kitchen with our Silicone Spatula Set – heat-resistant, durable, and perfect for all your cooking needs. Shop now and make cooking a breeze!",kitchen
Car Sun Shade,A reflective shade to protect your car's interior from sun damage.,"Protect your car from the sun with our Car Sun Shade – reflective, easy to use, and perfect for hot days. Shop now and keep your car cool!",automotive
Artisanal Bread,"Handcrafted bread made with high-quality ingredients, offering a rustic and wholesome taste.","Savor the tradition with our Artisanal Bread – baked with love, enjoyed with passion!",food
