product,description,ad,category
Trench coat," A classic, knee-length coat with a belted waist and double-breasted button front.","Introducing our timeless Trench Coat! Upgrade your wardrobe with this double-breasted, knee-length staple, featuring a belted waist for a flattering silhouette. Chic, versatile, essential. Get yours now!",clothes
Sponges,Multi-purpose sponges for cleaning dishes and surfaces.,"Clean with ease using our Sponges – versatile, durable, and perfect for dishes and surfaces. Shop now and make cleaning effortless!",cleaning
Mosquito Net,A protective net to keep insects away while sleeping or relaxing.,"Keep bugs at bay with our Mosquito Net – lightweight, easy to set up, and perfect for a peaceful night's sleep. Shop now and enjoy bug-free camping!",camping
Food Processor,"A versatile kitchen appliance for chopping, slicing, shredding, and pureeing ingredients quickly and easily.","Simplify your prep with our Food Processor – fast, efficient, and multifunctional!",kitchen
Camera Bag,A durable and stylish bag designed to protect and carry your camera and accessories.,Carry your gear in style with our Camera Bag – protection and convenience combined!,electronics
Portable Water Filter,A compact and efficient filter that ensures you have access to clean drinking water anywhere.,Stay hydrated anywhere with our Portable Water Filter – clean water on the go!,furniture
Noise-Canceling Headphones,"Premium headphones that block out external noise, offering an immersive listening experience.",Immerse yourself in sound with our Noise-Canceling Headphones – pure audio bliss!,health
Decorative Trays,"Elegant trays for organizing and displaying items on your coffee table or console, adding a touch of sophistication",Organize with elegance using our Decorative Trays – style and functionality in one!,furniture
External Hard Drive,A high-capacity drive for storing games and media with fast transfer speeds.,"Expand your storage with our External Hard Drive – high-capacity, fast, and perfect for gamers. Shop now and never run out of space!",gaming
Dog Toy Set,A set of durable and interactive toys to keep your dog entertained.,"Keep your dog entertained with our Dog Toy Set – durable, interactive, and perfect for playtime. Shop now and make every day fun!",pets
Ottoman with Storage,"A versatile ottoman that provides extra seating, footrest, and hidden storage space.","Maximize your space with our Ottoman – comfort, style, and storage in one!",furniture
Christmas Ornament Set,A collection of beautifully designed ornaments to decorate your tree and home.,Deck the halls with our Christmas Ornament Set – sparkle and shine for the holidays!,holidays
Nails and Screws,A variety of nails and screws for construction and woodworking.,"Secure your projects with our Nails and Screws – durable, reliable, and perfect for all your construction needs. Shop now and build with confidence!",construction
Silicone Baking Mats,"Reusable, non-stick mats for baking, offering an eco-friendly alternative to parchment paper.","Bake smarter with our Silicone Baking Mats – non-stick, reusable, and easy to clean!",kitchen
Garden Fountain,A decorative fountain to add a soothing water feature to your garden.,"Add a touch of tranquility to your garden with our Garden Fountain – decorative, soothing, and perfect for creating a peaceful atmosphere. Shop now and enjoy the sound of flowing water!",garden
Cement,A high-quality cement for strong and durable construction.,"Build with confidence using our Cement – strong, durable, and perfect for all your construction needs. Shop now and lay a solid foundation!",construction
Nebulizer,"A medical device that turns liquid medication into a mist for easy inhalation, ideal for respiratory conditions.",Breathe easier with our Nebulizer – effective relief for respiratory issues!,health
Capture Card,A device for recording and streaming gameplay from consoles and PCs.,"Share your gameplay with our Capture Card – high-quality, easy to use, and perfect for streamers. Shop now and start your streaming journey!",gaming
Meat Thermometer,A digital thermometer for checking the internal temperature of meat.,"Cook meat to perfection with our Meat Thermometer – accurate, easy to use, and essential for every home chef. Never overcook again!",kitchen
Fishing Net,A durable and lightweight net for landing your catch.,"Land your catch with ease using our Fishing Net – durable, lightweight, and perfect for all types of fish. Shop now and secure your prize!",fishing
Garden Soil Tester,A tool for testing soil pH and moisture levels to ensure optimal plant growth.,"Ensure your plants thrive with our Garden Soil Tester – easy to use, accurate, and perfect for monitoring soil health. Shop now and give your plants the best care!",garden
Leather biker jacket," A cropped, fitted jacket in leather material, featuring edgy details like zippers and studs.","Discover the ultimate edgy-chic look with our leather biker jacket! Fitted & cropped, it boasts rockin' zippers and studs. Unleash your inner rebel today. Elevate your wardrobe – ride with style!",clothes
Measuring Cups and Spoons,A set of precise measuring cups and spoons for accurate ingredient measurements.,Measure with precision using our Measuring Cups and Spoons – essential for every baker and chef. Perfect for creating delicious recipes every time!,kitchen
Decorative Figurines,Artistic figurines that add a unique and personal touch to your shelves or tables.,Add character to your space with our Decorative Figurines – art that tells a story!,furniture
Cosmetic Fridge,A mini fridge for storing skincare products and keeping them fresh.,"Keep your skincare fresh with our Cosmetic Fridge – compact, stylish, and perfect for storing your favorite products. Shop now and pamper your skin!",makeup
Ikat-print scarf," A scarf featuring a traditional, dyeing technique that creates distinctive, blurred geometric patterns.","Discover our Ikat-print scarf, blending tradition & style with its unique dyeing technique, showcasing stunning blurred geometric patterns. Elevate any outfit - Shop now!",clothes
Game Storage Case,A compact case for organizing and protecting game discs and cartridges.,"Keep your games safe with our Game Storage Case – compact, durable, and perfect for organizing your collection. Shop now and protect your games!",gaming
Cigarette pants," Slim, ankle-length pants with a streamlined silhouette, perfect for business or casual wear.","Introducing Cigarette pants! Slim, ankle-length & stylish. Elevate business or casual attire with a sleek silhouette. Shop now for a versatile wardrobe essential. #CigarettePantsFashionUpgrade",clothes
Oversized Puffer Jacket,A voluminous puffer jacket with a baggy fit designed to keep you warm and stylish during colder months.,Stay warm and stylish with an oversized puffer jacket.,clothes
Gaming Backpack,A durable backpack designed to carry gaming laptops and accessories.,"Carry your gear with our Gaming Backpack – durable, spacious, and perfect for gamers on the go. Shop now and keep your setup safe and organized!",gaming
Car Cup Holder Expander,An expandable cup holder to fit larger cups and bottles in your car.,Fit all your drinks with our Car Cup Holder Expander – adjustable,automotive
Travel Journal,"A beautifully designed journal to document your travels, memories, and experiences.","Capture your adventures with our Travel Journal – your story, beautifully told!",jewelry
Peplum blouse," A fitted blouse with a flared ruffle at the waist, adding extra dimension and interest.","Discover elegance with our Peplum Blouse! Fitted design meets a flared waist ruffle, perfect for adding dimension & interest to your outfit. Shop now to upgrade your wardrobe with timeless style.",clothes
Fishing Pliers,"Multi-functional pliers for cutting line, removing hooks, and more.","Handle all your fishing tasks with our Fishing Pliers – versatile, durable, and perfect for cutting line and removing hooks. Shop now and make your fishing easier!",fishing
Mock-neck sweater," A pullover sweater with a high, close-fitting neckline that provides warmth and style.","Stay warm, look chic! Our Mock-neck Sweater is the perfect blend of cozy comfort and on-trend style. Don’t let the cold cramp your fashion game - Shop now and stand out from the crowd.",clothes
Pet Water Fountain,A flowing water fountain to keep your pet hydrated and entertained.,"Keep your pet hydrated with our Pet Water Fountain – flowing, filtered, and perfect for encouraging drinking. Shop now and make hydration fun!",pets
Minimalist Gold Ring,"A simple yet elegant gold ring, perfect for everyday wear.",Keep it simple and stylish with our Minimalist Gold Ring – a timeless piece that complements any outfit. Perfect for everyday elegance. Shop now!,jewelry
Air Fryer,"A compact and efficient appliance that fries food with little to no oil, offering a healthier alternative to traditional frying.","Fry healthier with our Air Fryer – crispy, delicious, and guilt-free!",kitchen
Sleeping Bag,A warm and comfortable sleeping bag designed for various weather conditions.,"Stay cozy on your camping trips with our Sleeping Bag – lightweight, warm, and perfect for all seasons. Shop now and sleep comfortably in the great outdoors!",camping
Outdoor Play Tent,"A colorful and easy-to-assemble tent for indoor or outdoor play, perfect for adventures and hideouts.",Unleash your child’s imagination with our Outdoor Play Tent – a world of adventure awaits!,toys
Lip Gloss Set,A set of shiny and hydrating lip glosses in various shades.,"Add a touch of shine with our Lip Gloss Set – hydrating, glossy, and perfect for every look. Shop now and make your lips pop!",makeup
Tulle skirt," A voluminous skirt featuring multiple layers of tulle, perfect for creating a ballerina-inspired look.","Upgrade your wardrobe with our Tulle Extravaganza Skirt🌟! Twirl into a dream of fluffy layers, crafted for fashionable ballerina vibes✨. Get ready to be the center of attention and order now! #tulleskirt",clothes
Hybrid Car,A fuel-efficient car that combines a gasoline engine with an electric motor for reduced emissions and better mileage.,Go green without compromise with our Hybrid Car – efficiency meets performance!,cars
Pet Hair Remover,A tool for easily removing pet hair from furniture and clothing.,"Say goodbye to pet hair with our Pet Hair Remover – easy to use, effective, and perfect for keeping your home clean. Shop now and enjoy a hair-free environment!",gaming
Folding Screen,A decorative and functional screen that can be used to divide spaces or add a touch of elegance to your room.,Define your space with our Folding Screen – style and privacy in one!,furniture
Garden Edging,Decorative edging to define garden beds and pathways.,"Define your garden beds with our Garden Edging – decorative, durable, and perfect for creating clean lines. Shop now and enhance your garden's appearance!",garden
Jumpsuit," A one-piece garment that combines a top and pants, offering a streamlined and fashionable look.",Upgrade your wardrobe with our chic Jumpsuit – the perfect blend of style and comfort. Our one-piece top & pants combo creates a sleek silhouette that's a must-have. Shop now - be effortlessly stylish!,clothes
Highlighters,A set of bright highlighters for marking important text and notes.,"Highlight what matters with our Highlighters – bright, smooth, and perfect for marking important text. Shop now and make your notes stand out!",writing
Wide-leg trousers," Pants with a loose and flowing fit, creating an elongated and sophisticated silhouette.","Introducing our Wide-Leg Trousers: Effortlessly chic and endlessly versatile. Discover a flattering, comfortable fit that creates an elegant, elongated silhouette. Elevate your style today!",clothes
Chunky knit sweater," A thick, textured sweater knitted with a heavier yarn, perfect for cozy layering.","Stay warm this season with our Chunky Knit Sweater! Thick, textured & perfect for cozy layering. Unbeatable comfort & style wrapped into one. Shop now & snuggle up!",clothes
Silver Cuff Bracelet,A bold and modern silver cuff bracelet that adds an edgy touch to any outfit.,Make a bold statement with our Silver Cuff Bracelet – a modern and edgy accessory that’s perfect for adding a touch of attitude to your look. Shop now and embrace your inner rebel!,jewelry
Bolero-style jacket," A short, open-fronted jacket with a cropped hemline, perfect for layering over a dress or top.","Discover the versatile Bolero Jacket! Ideal for layering over dresses or tops, this chic, open-front cropped jacket elevates any outfit. Effortlessly stylish, comfortably classy. Get yours today!",clothes
Digital Camera,A high-quality camera that captures stunning photos and videos with advanced features and settings.,Capture every moment with our Digital Camera – professional quality in your hands!,electronics
Fishing Rod Holder,A sturdy holder for keeping your rod secure while waiting for a bite.,"Keep your rod secure with our Fishing Rod Holder – sturdy, durable, and perfect for all your fishing needs. Shop now and wait for the bite in comfort!",fishing
Laptop,"A portable computer designed for work, study, and entertainment, offering powerful performance in a sleek design.","Power up your productivity with our Laptop – work smarter, anywhere, anytime!",electronics
VR Headset,A virtual reality headset for immersive gaming experiences.,"Step into another world with our VR Headset – immersive, high-quality, and perfect for gaming. Shop now and experience the future of gaming!",gaming
Planters and Pots,A variety of stylish and durable planters for indoor and outdoor plants.,"Add style to your garden with our Planters and Pots – durable, stylish, and perfect for all your plants. Shop now and create a beautiful garden space!",garden
Capri pants," Three-quarter length pants that end mid-calf, perfect for a casual summer ensemble.","Upgrade your summer wardrobe with our stylish Capri pants! Ideal for casual outings, these three-quarter length pants end mid-calf, ensuring comfort and chic all season long. Shop now and stay on-trend!",clothes
Pearl Stud Earrings,Classic and timeless earrings featuring genuine pearls for a sophisticated look.,Elevate your elegance with our Pearl Stud Earrings – timeless beauty for every occasion. Shop now and add a touch of sophistication to your style!,jewelry
Fishing Backpack,A spacious and durable backpack for carrying all your fishing gear.,"Carry all your gear with our Fishing Backpack – spacious, durable, and perfect for all your fishing adventures. Shop now and stay organized on the go!",fishing
Portable Power Bank,A high-capacity power bank for charging devices while camping.,"Stay connected with our Portable Power Bank – high-capacity, durable, and perfect for charging your devices in the wild. Shop now and never run out of power!",camping
Metallic pleated skirt," A skirt featuring narrow, accordion-like pleats and a shiny, metallic finish.","Discover the stunning Metallic Pleated Skirt - chic, accordion-style pleats meet a lustrous metallic finish for a fashion-forward look that dazzles. Elevate your wardrobe now!",clothes
Compact Car,"A small and efficient car perfect for city driving, offering great fuel economy and easy maneuverability.","Navigate the city with ease in our Compact Car – smart, efficient, and stylish!",cars
Choker necklace," A close-fitting necklace that sits snugly around the neck, adding a bold detail to any outfit.","""Revolutionize your style with our Choker necklace! This close-fitting accessory adds striking details to any outfit & accentuates your neckline. Elevate your wardrobe now! #FashionStatement""",clothes
Distressed Oversized Denim Shirt,An oversized denim shirt with distressed details perfect for layering or wearing as a statement piece.,Effortlessly cool with a touch of urban edge.,clothes
Herb Stripper,A tool for quickly stripping herbs from their stems.,Prep herbs in seconds with our Herb Stripper – perfect for cooking and garnishing. Make meal prep faster and easier!,kitchen
Shift dress," A loose, knee-length dress that doesn't cling to the body, providing a versatile and flattering silhouette.",Discover the perfect blend of style & comfort with our Shift Dress - the ultimate wardrobe staple that flatters every shape! Shop now for a versatile & chic knee-length steal. Say hello to effortless elegance.,clothes
RGB Gaming Desk Pad,"A large, smooth desk pad with customizable RGB lighting, perfect for enhancing your gaming setup and providing ample space for your mouse and keyboard.",Elevate your gaming experience with a desk pad that lights up your play.,gaming
Sticky Notes,"Colorful sticky notes for reminders, notes, and brainstorming.","Stay organized with our Sticky Notes – colorful, versatile, and perfect for reminders and brainstorming. Shop now and keep your ideas in sight!",writing
Duster coat," A long, lightweight coat that falls below the knee, offering an elongated silhouette.",Discover unparalleled style & comfort with our Duster Coats - the perfect blend of chic & lightweight design for a sleek silhouette that falls below the knee. Elevate your wardrobe now!,clothes
Backpack,A durable and ergonomic backpack designed for comfort and convenience during travel.,Explore the world with our Travel Backpack – comfort and style for every adventure!,camping
Car Backseat Organizer,A versatile organizer for keeping your backseat tidy and functional.,"Organize your backseat with our Car Backseat Organizer – versatile, durable, and perfect for keeping essentials within reach. Shop now and keep your car clutter-free!",automotive
Quilted handbag," A handbag with a quilted design, stitching pattern, and, often, made from soft leather or fabric.","Introducing our Quilted Handbags: The luxurious merger of style, comfort, and sophistication. Discover the ultimate accessory - crafted with premium fabrics and refined stitching patterns. Elevate your ensemble now!",clothes
Electric SUV,"A spacious and eco-friendly SUV powered by electricity, offering a smooth ride and advanced technology","Drive the future with our Electric SUV – power, space, and sustainability combined!",cars
RGB Lighting Kit,A set of RGB lights to customize your gaming setup with vibrant colors.,"Light up your gaming space with our RGB Lighting Kit – customizable, vibrant, and perfect for creating the ultimate gaming atmosphere. Shop now and set the mood!",gaming
Vegetable Spiralizer,A tool that turns vegetables into spiralized noodles for healthy meals.,"Get creative in the kitchen with our Vegetable Spiralizer – perfect for making healthy, low-carb meals. Spiralize your way to better eating today!",kitchen
Chenille sweater," A soft, plush sweater made from chenille fabric, providing warmth and comfort.",Introducing the Chenille Sweater: Experience ultimate warmth & comfort in our deluxe plush knitwear. Elegance meets coziness. Perfect for any occasion. Be stylish. Stay snug. Shop now!,clothes
Car LED Interior Lights,Bright and energy-efficient LED lights for illuminating your car's interior.,"Brighten up your car with our Car LED Interior Lights – energy-efficient, easy to install, and perfect for nighttime visibility. Shop now and enhance your car's interior!",automotive
Coffee Table Books,A collection of beautifully illustrated books that add a touch of sophistication to your coffee table.,"Accessorize your space with our Coffee Table Books – art, culture, and conversation starters!",furniture
Utility jacket," A durable, often oversized jacket featuring multiple pockets and a structured, military-inspired design.","Introducing the Utility Jacket: Military-inspired design meets ultimate functionality. Oversized and durable, featuring ample pockets for all your on-the-go essentials. Get yours now and take on any day with style and efficiency!",clothes
Pencil skirt," A knee-length, slim-fitting skirt that hugs the hips and tapers slightly at the bottom.","Introducing the Pencil Skirt: Elegance meets comfort with this knee-length, slim-fitting skirt. Hugging your hips and gently tapering at the bottom, it's perfect for any occasion. Upgrade your wardrobe now!",clothes
Area Rug,A soft and durable rug that adds warmth and style to your living room floor.,"Anchor your space with our Area Rug – cozy, stylish, and perfect for any room!",furniture
Trash Bags,Durable and leak-proof bags for disposing of waste.,"Keep your trash contained with our Trash Bags – durable, leak-proof, and perfect for all your waste disposal needs. Shop now and keep your home clean and tidy!",cleaning
Gourmet Pasta Sauce,"A rich and flavorful sauce made from ripe tomatoes and fresh herbs, perfect for enhancing your pasta dishes.","Transform your meals with our Gourmet Pasta Sauce – authentic taste, homemade love!",food
Embroidered jeans," Jeans featuring intricate, embroidered designs on the pockets, waistband or legs.","Discover stunning style in every stitch with our Embroidered Jeans collection! Adorn your wardrobe with intricate, one-of-a-kind designs on pockets, waistbands & legs. Elevate your denim game now!",clothes
Christmas Village Set,A charming collection of miniature houses and figures to create a magical holiday village display.,Build a winter wonderland with our Christmas Village Set – a festive centerpiece for your home!,holidays
Portable Gaming Monitor,"A lightweight, portable monitor with high refresh rates, perfect for gaming on the go or expanding your setup.","Take your gaming visuals anywhere – crisp, fast, and portable.",gaming
Convertible,"A stylish and fun-to-drive car with a retractable roof, perfect for enjoying sunny days and open roads.",Feel the freedom with our Convertible – where every drive is an adventure!,cars
Luxury Sedan,"A premium sedan offering a luxurious interior, advanced safety features, and a smooth, comfortable ride.",Experience elegance on the road with our Luxury Sedan – sophistication in every detail!,cars
Garlic Press,A sturdy garlic press that minces garlic quickly and efficiently.,"Make mincing garlic a breeze with our Garlic Press – durable, easy to clean, and perfect for adding flavor to your dishes. Shop now and elevate your cooking!",kitchen
Blender,"A powerful blender for making smoothies, soups, sauces, and more, with easy-to-clean components.","Blend your way to deliciousness with our Blender – smooth, creamy, and perfect every time!",kitchen
Wheelchair,A lightweight and foldable wheelchair designed for easy mobility and comfort for those with limited mobility.,Regain your independence with our Wheelchair – mobility and comfort in one!,health
Compression Socks,Therapeutic socks designed to improve circulation and reduce swelling in the legs and feet.,Step into comfort with our Compression Socks – support and relief for your legs!,health
Resistance Bands Set,"A set of durable resistance bands for strength training, stretching, and rehabilitation exercises.","Boost your workout with our Resistance Bands Set – versatile, portable, and effective!",sport
Wall Decals,"Easy-to-apply and removable wall decals in various designs, perfect for adding a personal touch to your walls.",Personalize your space with our Wall Decals – creativity at your fingertips!,furniture
Car Seat Gap Organizer,A compact organizer for storing small items in the gap between your car seats.,"Organize your car with our Car Seat Gap Organizer – compact, practical, and perfect for storing small items. Shop now and keep your essentials within reach!",automotive
Car Trunk Organizer,A spacious organizer for keeping your trunk tidy and efficient.,"Organize your trunk with our Car Trunk Organizer – spacious, durable, and perfect for all your storage needs. Shop now and keep your car clutter-free!",automotive
Camping Hammock,A lightweight and portable hammock for relaxing between trees.,"Relax in nature with our Camping Hammock – lightweight, easy to set up, and perfect for a peaceful retreat. Shop now and add comfort to your outdoor adventures!",camping
Garden Storage Box,A weather-resistant box for storing garden tools and accessories.,"Keep your garden tools organized with our Garden Storage Box – weather-resistant, spacious, and perfect for all your gardening needs. Shop now and keep your tools safe and dry!",garden
Stainless Steel Cleaner,A specialized cleaner for polishing and maintaining stainless steel surfaces.,"Keep your stainless steel shining with our Stainless Steel Cleaner – effective, easy to use, and perfect for all stainless steel surfaces. Shop now and enjoy a polished look!",cleaning
Microfiber Cleaning Cloths,Soft and absorbent cloths for dusting and cleaning surfaces.,"Achieve a streak-free shine with our Microfiber Cleaning Cloths – soft, absorbent, and perfect for all surfaces. Shop now and make cleaning a breeze!",cleaning
Adjustable Dumbbells,"Space-saving dumbbells with adjustable weights, ideal for a full-body workout at home.",Transform your fitness routine with our Adjustable Dumbbells – strength training made simple!,sport
Jeep Wrangler,A rugged off-road SUV with a removable roof and doors perfect for adventure seekers.,Conquer any terrain with the iconic Jeep Wrangler.,cars
Kimono-style robe," A loose, flowing robe with wide sleeves, inspired by traditional Japanese garments.","Unleash your inner elegance with our Kimono-style robe! Drift into tranquility with its loose, flowing design & wide sleeves. Embrace the marriage of tradition and modern sophistication. Shop now!",clothes
