product,description,ad,category
Watering Can,A sturdy and ergonomic watering can for indoor and outdoor plants.,"Water your plants with ease using our Watering Can – sturdy, ergonomic, and perfect for all your gardening needs. Shop now and keep your plants thriving!",garden
Strawberry Cheesecake Bites,Bite-sized treats combining the creamy richness of cheesecake with the sweetness of strawberries.,Savor the flavor with our Strawberry Cheesecake Bites – a little bite of heaven!,food
Accent Chairs,Stylish and comfortable chairs that add a splash of color and extra seating to your living room.,Complete your look with our Accent Chairs – comfort and style in every detail!,furniture
Makeup Primer,A smoothing primer for creating a flawless base for your makeup.,"Prep your skin with our Makeup Primer – smoothing, long-lasting, and perfect for a flawless base. Shop now and make your makeup last all day!",makeup
Lipstick Holder,A sleek holder for organizing and displaying your lipstick collection.,"Keep your lipsticks organized with our Lipstick Holder – sleek, compact, and perfect for displaying your collection. Shop now and add a touch of elegance to your vanity!",makeup
Tripod,"A sturdy and adjustable stand to stabilize your camera for sharp, clear photos and videos.",Steady your shots with our Tripod – perfect stability for every photo!,electronics
Decorative Lanterns,"Stylish lanterns that can hold candles or LED lights, creating a warm and inviting atmosphere.",Illuminate your space with our Decorative Lanterns – a cozy glow for any room!,furniture
Ruffleneck sweater," A sweater featuring a large, oversized collar that adds warmth and a statement to the garment.",Discover our Ruffleneck sweater - a perfect blend of style and warmth! Stay cozy in a bold oversized collar that elevates your winter wardrobe. Shop now for a statement piece that turns heads!,clothes
Organic Tea Blends,"A selection of finely crafted tea blends made from organic herbs and leaves, offering a soothing and aromatic experience.","Unwind with our Organic Tea Blends – pure, calming, and delicious!",food
Beaded Anklet,"A delicate anklet featuring colorful beads, perfect for summer or beachwear.",Get ready for summer with our Beaded Anklet – a delicate and colorful accessory that’s perfect for beach days or casual outings. Shop now and add a touch of fun to your look!,jewelry
Treadmill,A high-performance treadmill with adjustable speed and incline settings for a complete cardio workout at home.,"Run anytime, anywhere with our Treadmill – your path to fitness starts here!",sport
Electric Car,"An eco-friendly vehicle powered by electricity, offering a smooth and silent driving experience with zero emissions.","Drive into the future with our Electric Car – sustainable, stylish, and smart!",cars
Christmas Stockings,"Festive stockings in various designs, perfect for hanging by the fireplace and filling with gifts.",Stuff them with joy using our Christmas Stockings – a holiday tradition for everyone!,holidays
Travel Pillow,A comfortable and supportive pillow designed for restful sleep during flights or long journeys.,Sleep soundly with our Travel Pillow – comfort on the go!,camping
Insulation Material,High-performance insulation for maintaining temperature and energy efficiency.,"Keep your home comfortable with our Insulation Material – energy-efficient, easy to install, and perfect for all climates. Shop now and save on energy costs!",construction
Non-Stick Baking Mat,A reusable baking mat that ensures even baking and easy cleanup.,"Bake smarter with our Non-Stick Baking Mat – reusable, eco-friendly, and perfect for cookies, pastries, and more. Say goodbye to messy baking sheets!",kitchen
Mechanical Pencil,A durable and precise mechanical pencil for detailed writing and drawing.,"Write and draw with precision using our Mechanical Pencil – durable, reliable, and perfect for detailed work. Shop now and enjoy consistent performance!",writing
Lace-up sandals," Shoes featuring laces or ties that wrap around the foot and, in some cases, the ankle.",Introducing our latest Lace-up Sandals - where style meets comfort! Wrap your feet in chic designs and experience unbeatable support. Perfect for summer strolls & beachside bliss. Shop now!,clothes
Extra Virgin Olive Oil,"Cold-pressed olive oil with a rich, fruity flavor, perfect for cooking and drizzling.",Elevate your dishes with our Extra Virgin Olive Oil – the essence of the Mediterranean!,food
Dark Chocolate Covered Almonds,"Crunchy almonds coated in rich, dark chocolate for a healthy yet indulgent snack.",Crunch into happiness with our Dark Chocolate Covered Almonds – a perfect balance of health and indulgence!,food
Peanut Butter Cups,"Creamy peanut butter encased in smooth milk chocolate, offering a perfect balance of flavors.",Peanut butter lovers rejoice with our Peanut Butter Cups – a classic treat you’ll adore!,food
Digital Thermometer,"A fast and accurate thermometer for measuring body temperature, featuring a digital display for easy reading.","Stay informed with our Digital Thermometer – quick, accurate, and reliable!",health
Camping Table,A foldable and portable table for meals and activities at the campsite.,"Make your campsite more functional with our Camping Table – foldable, lightweight, and perfect for meals and games. Shop now and enhance your outdoor experience!",camping
Asymmetrical dress," A dress with an uneven hemline or design, creating visual interest and balance.",Discover the perfect blend of style & comfort with our Asymmetrical Dresses! Turn heads with unique hemlines & designs that create visual intrigue - Shop Now & redefine your fashion game!,clothes
Pet Cooling Mat,A cooling mat to keep your pet comfortable during hot weather.,"Keep your pet cool with our Pet Cooling Mat – self-cooling, portable, and perfect for hot days. Shop now and beat the heat!",pets
Silicone Baking Cups,"Reusable and non-stick baking cups for muffins, cupcakes, and more.","Bake smarter with our Silicone Baking Cups – eco-friendly, easy to clean, and perfect for all your baking needs. Say goodbye to paper liners!",kitchen
Patchwork Denim Jacket,A unique denim jacket made with patchwork designs offering a one-of-a-kind streetwear aesthetic.,Stand out with a jacket that’s as unique as you are.,clothes
Interactive Robot Toy,"A smart robot that interacts with kids through voice commands, games, and educational activities.","Meet your child’s new best friend – our Interactive Robot Toy, where learning meets fun!",toys
Paint,High-quality paint for interior and exterior surfaces.,"Transform your space with our Paint – durable, vibrant, and perfect for walls, ceilings, and more. Shop now and add a splash of color to your home!",construction
Oversized Graphic Hoodie,"A cozy, oversized hoodie featuring bold, artistic graphics, perfect for a relaxed yet stylish streetwear look.",Make a statement with bold graphics and ultimate comfort.,clothes
Dog Life Jacket,A buoyant life jacket for safe swimming and water activities.,"Keep your dog safe in the water with our Dog Life Jacket – buoyant, adjustable, and perfect for swimming. Shop now and make a splash!",pets
Desk Organizer,"A stylish organizer for keeping pens, paper, and other stationery in order.","Keep your workspace tidy with our Desk Organizer – stylish, functional, and perfect for all your stationery needs. Shop now and stay organized!",writing
Gravel,Durable gravel for construction and landscaping projects.,"Build and landscape with our Gravel – durable, versatile, and perfect for driveways, paths, and more. Shop now and add strength to your projects!",construction
Silicone Oven Mittens,Heat-resistant silicone mittens for safe handling of hot pots and pans.,"Protect your hands with our Silicone Oven Mittens – heat-resistant, durable, and perfect for all your cooking needs. Shop now and cook with confidence!",kitchen
Rose Gold Ear Cuff,A trendy ear cuff that wraps around your ear for a unique and modern look.,Stay ahead of the trends with our Rose Gold Ear Cuff – a unique and modern accessory that’s perfect for adding a touch of edge to your style. Shop now and embrace the future of fashion!,jewelry
Sapphire Cocktail Ring,A bold and luxurious ring featuring a stunning sapphire stone for a pop of color.,Add a splash of color with our Sapphire Cocktail Ring – a bold and luxurious piece that’s perfect for making a statement. Shop now and embrace the elegance!,jewelry
Pet Carrier Backpack,A comfortable and ventilated backpack for transporting small pets.,"Take your furry friend anywhere with our Pet Carrier Backpack – comfortable, secure, and perfect for adventures. Shop now and explore the world together!",pets
Makeup Blotting Papers,Oil-absorbing papers for keeping your skin matte and fresh throughout the day.,"Control shine with our Makeup Blotting Papers – lightweight, effective, and perfect for keeping your skin matte. Shop now and stay fresh all day!",makeup
Gaming Headset,A comfortable headset with surround sound and a noise-canceling microphone.,"Immerse yourself in the game with our Gaming Headset – crystal-clear sound, noise-canceling mic, and perfect for long sessions. Shop now and hear every detail!",gaming
Silicone Whisk,A heat-resistant silicone whisk for mixing and beating ingredients.,"Mix and whisk with ease using our Silicone Whisk – heat-resistant, durable, and perfect for all your cooking needs. Shop now and make cooking a breeze!",kitchen
Riding boots," Tall, knee-high boots designed to protect the legs for equestrian activities, but versatile enough to be worn in everyday styling.","Discover timeless Riding Boots 🐎 Elegant knee-high protection for equestrians, yet versatile enough for everyday fashion. Get ready to saddle up in style! Shop now.",clothes
Decorative Curtains,"Stylish curtains in various fabrics and patterns, perfect for adding color and texture to your windows.",Frame your windows with our Decorative Curtains – elegance and privacy combined!,furniture
Running Shoes,Lightweight and durable shoes designed for optimal performance and comfort during running.,Step up your run with our Running Shoes – where every stride feels effortless!,clothes
Rose Gold Bracelet,A sleek rose gold bracelet that adds a modern and feminine touch to your wrist.,"Add a touch of modern femininity with our Rose Gold Bracelet – sleek, stylish, and perfect for any occasion. Elevate your wrist game today!",jewelry
Pencil Case,"A durable and stylish case for organizing pens, pencils, and other stationery.","Keep your stationery organized with our Pencil Case – durable, stylish, and perfect for all your writing tools. Shop now and carry your essentials in style!",writing
Fishing Line,A strong and durable line for various fishing conditions.,"Ensure a strong catch with our Fishing Line – durable, reliable, and perfect for all fishing conditions. Shop now and never lose a fish again!",fishing
Multi-Tool Knife,A versatile tool with various functions for camping and outdoor activities.,"Be prepared for anything with our Multi-Tool Knife – versatile, durable, and essential for every camping trip. Shop now and tackle any challenge!",camping
Racerback tank," A sleeveless top with a T-shaped strap across the upper back, offering a sporty, casual look.",Introducing our trendy Racerback Tank! It's a stylish and sporty sleeveless top featuring a unique T-shaped strap design across the upper back. Get ready for comfort and compliments! Shop now.,clothes
Sports Coupe,"A sleek and high-performance coupe designed for speed enthusiasts, offering thrilling acceleration and precision handling.",Feel the adrenaline with our Sports Coupe – where speed meets style!,cars
Graffiti Print T-Shirt,A soft breathable T-shirt featuring edgy graffiti-inspired prints ideal for a casual streetwear look.,Wear your attitude with bold urban-inspired designs.,clothes
Car Seat Covers,Durable and stylish covers to protect and enhance your car seats.,"Protect your seats with our Car Seat Covers – durable, stylish, and perfect for any car. Shop now and keep your car looking new!",automotive
Notebook Stand,A sturdy stand to hold your notebook or tablet at the perfect angle for writing.,"Improve your writing posture with our Notebook Stand – sturdy, adjustable, and perfect for holding your notebook or tablet. Shop now and write comfortably!",writing
Artificial Christmas Tree,A realistic and easy-to-assemble artificial tree that brings the holiday spirit into your home,Celebrate in style with our Artificial Christmas Tree – the perfect centerpiece for your holiday decor!,holidays
Makeup Palette,"A versatile palette with a range of eyeshadows, blushes, and bronzers.","Create endless looks with our Makeup Palette – versatile, pigmented, and perfect for every occasion. Shop now and unleash your creativity!",makeup
Nautical-striped sweater," A classic, horizontally-striped sweater inspired by maritime pursuits.","Discover our timeless Nautical-striped Sweater! Exude maritime elegance with this classic, horizontal-striped design inspired by seafaring adventures. Set sail in style today. #AhoyChicFashion",clothes
Mechanical Keyboard,A durable keyboard with mechanical switches for fast and responsive typing.,"Type and play like a pro with our Mechanical Keyboard – responsive, durable, and perfect for gaming. Shop now and feel the difference!",gaming
Decorative Table Lamps,Elegant table lamps that provide soft lighting and add a touch of sophistication to your side tables or console.,Light up your decor with our Decorative Table Lamps – ambiance and style in every glow!,furniture
Plumbing Fixtures,High-quality fixtures for bathrooms and kitchens.,"Upgrade your plumbing with our Plumbing Fixtures – durable, stylish, and perfect for any bathroom or kitchen. Shop now and add functionality and style to your home!",construction
Sports Water Bottle,durable and leak-proof water bottle designed to keep you hydrated during workouts.,Stay hydrated and focused with our Sports Water Bottle – essential for every athlete!,sport
Roofing Shingles,Durable and weather-resistant shingles for roofing.,"Protect your home with our Roofing Shingles – durable, weather-resistant, and perfect for any roof. Shop now and keep your home safe and dry!",construction
Boxing Gloves,"High-quality gloves designed for boxing and MMA, offering excellent protection and comfort.","Train like a champion with our Boxing Gloves – power, precision, and protection!",sport
Dog Training Clicker,A clicker for positive reinforcement during dog training sessions.,"Train your dog with ease using our Dog Training Clicker – simple, effective, and perfect for positive reinforcement. Shop now and make training fun!",pets
Makeup Pencil Sharpener,A durable sharpener for keeping your makeup pencils precise and ready to use.,"Keep your makeup pencils sharp with our Makeup Pencil Sharpener – durable, easy to use, and perfect for precise application. Shop now and stay ready for every look!",makeup
STEM Science Kit,"An educational kit that introduces kids to science, technology, engineering, and math through fun experiments.",Spark curiosity with our STEM Science Kit – where learning becomes an adventure!,toys
Graph Paper Notebook,"A notebook with graph paper for precise writing, drawing, and planning.",Plan and draw with precision using our Graph Paper Notebook – perfect for detailed work and organized notes. Shop now and bring your ideas to life!,writing
Electric Scooter,"A lightweight, eco-friendly scooter perfect for short commutes, offering convenience and fun in urban environments.","Zip through the city with our Electric Scooter – fast, fun, and eco-friendly!",electronics
Fitness Tracker," A wearable device that monitors your activity, heart rate, and sleep to help you stay on track with your fitness goals.",Track your progress with our Fitness Tracker – your personal coach on your wrist!,sport
Photo Frame,A decorative frame to showcase your favorite photos in style.,Display your memories with our Photo Frame – elegance for every picture!,electronics
Adjustable Rolling Pin,A rolling pin with adjustable thickness guides for perfect dough rolling.,"Roll dough like a pro with our Adjustable Rolling Pin – perfect for pies, cookies, and more. Achieve the perfect thickness every time!",kitchen
Robot Vacuum Cleaner,"An automated vacuum that cleans your floors effortlessly, saving you time and energy.","Let our Robot Vacuum Cleaner do the dirty work – clean floors, zero effort!",cleaning
Concrete Blocks,Sturdy concrete blocks for building walls and foundations.,"Build strong and durable walls with our Concrete Blocks – sturdy, reliable, and perfect for any construction project. Shop now and lay the groundwork for success!",construction
Garden Insect Repellent,A natural repellent to protect plants from pests and insects.,"Protect your plants with our Garden Insect Repellent – natural, effective, and perfect for keeping pests at bay. Shop now and enjoy a healthy, pest-free garden!",garden
Plush Stuffed Animal,"A soft and cuddly stuffed animal, perfect for comforting and imaginative play.",Snuggle up with our Plush Stuffed Animal – your child’s new favorite companion!,toys
Floor Lamp,A sleek and modern floor lamp that provides both ambient lighting and a stylish focal point.,Light up your space with our Floor Lamp – functional and fashionable!,furniture
Pulse Oximeter,"A compact device that measures blood oxygen levels and heart rate, essential for monitoring respiratory health.","Monitor your health with our Pulse Oximeter – quick, accurate, and portable!",health
Luggage Set,A stylish and durable set of suitcases with smooth-rolling wheels and secure locks.,Travel in style with our Luggage Set – durability and elegance combined!,camping
Pet Stroller,A lightweight and foldable stroller for transporting small pets.,"Take your pet on the go with our Pet Stroller – lightweight, foldable, and perfect for small dogs and cats. Shop now and enjoy walks together!",pets
Cat Scratching Post,A sturdy scratching post to keep your cat's claws healthy and your furniture safe.,"Save your furniture with our Cat Scratching Post – durable, stylish, and perfect for keeping your cat entertained. Shop now and keep your home scratch-free!",pets
Fountain Pen,A high-quality fountain pen for smooth and elegant writing.,"Elevate your writing with our Fountain Pen – smooth, elegant, and perfect for every occasion. Shop now and experience the art of writing!",writing
Pet GPS Tracker,A GPS device to track your pet's location in real-time.,"Never lose your pet again with our Pet GPS Tracker – real-time tracking, lightweight, and perfect for adventurous pets. Shop now and keep your furry friend safe!",pets
PVC Pipes,Durable and corrosion-resistant PVC pipes for plumbing and drainage.,"Ensure smooth plumbing with our PVC Pipes – durable, corrosion-resistant, and perfect for all your plumbing needs. Shop now and keep the water flowing!",construction
Portable Water Filter,A compact filter for purifying water from natural sources while camping.,"Stay hydrated safely with our Portable Water Filter – compact, efficient, and perfect for purifying water from streams and lakes. Shop now and explore worry-free!",camping
Electric Train Set,"A complete train set with tracks, locomotives, and accessories for hours of creative play.",All aboard for fun with our Electric Train Set – the ultimate adventure on rails!,toys
Floor Sweeper,A lightweight and efficient sweeper for quick floor cleanups.,"Sweep up messes quickly with our Floor Sweeper – lightweight, efficient, and perfect for quick cleanups. Shop now and keep your floors spotless!",cleaning
Bookshelf,A sturdy and stylish bookshelf designed to organize and display your book collection and decor items.,Organize your world with our Bookshelf – a perfect blend of function and style!,furniture
Car Windshield Cover,"A protective cover to shield your windshield from frost, snow, and debris.","Protect your windshield with our Car Windshield Cover – durable, easy to use, and perfect for all weather conditions. Shop now and make winter mornings easier!",automotive
Reclining Armchair,"A comfortable and stylish armchair with a reclining feature, perfect for relaxing after a long day.",Relax in style with our Reclining Armchair – ultimate comfort at your fingertips!,furniture
Modern Sofa Bed,"A stylish and versatile sofa that transforms into a comfortable bed, perfect for small spaces.",Style meets functionality with our Modern Sofa Bed – perfect for lounging and sleeping!,furniture
Fishing Hooks,A variety of hooks for different types of fish and fishing techniques.,"Hook your catch with our Fishing Hooks – versatile, sharp, and perfect for all types of fish. Shop now and increase your chances of success!",fishing
Inflatable Sleeping Pad,A comfortable and portable pad for a better night's sleep while camping.,"Sleep comfortably with our Inflatable Sleeping Pad – lightweight, easy to inflate, and perfect for any terrain. Shop now and wake up refreshed!",camping
Compost Bin,A durable bin for composting organic waste and creating nutrient-rich soil.,"Turn your kitchen scraps into gold with our Compost Bin – durable, easy to use, and perfect for creating rich compost. Shop now and enrich your garden soil!",garden
False Eyelashes,High-quality false eyelashes for adding volume and length to your natural lashes.,"Enhance your lashes with our False Eyelashes – natural, easy to apply, and perfect for adding volume and length. Shop now and make your eyes stand out!",makeup
Fire Starter Kit,A reliable kit for starting campfires in any weather condition.,"Start your campfire with ease using our Fire Starter Kit – reliable, weather-resistant, and perfect for any outdoor adventure. Shop now and keep warm under the stars!",camping
Calligraphy Set,A complete set for beginners and experts to practice calligraphy.,"Master the art of calligraphy with our Calligraphy Set – complete, easy to use, and perfect for creating beautiful lettering. Shop now and start your calligraphy journey!",writing
Baggie Pleated Skirt,A stylish pleated skirt with a loose and flowy fit perfect for a feminine yet edgy streetwear look.,A stylish pleated skirt with a loose and flowy fit perfect for a feminine yet edgy streetwear look.,clothes
Folding Camping Chair,A lightweight and portable chair for comfortable seating at the campsite.,"Relax in comfort with our Folding Camping Chair – lightweight, portable, and perfect for any outdoor setting. Shop now and make your camping experience more enjoyable!",camping
Writing Planner,A detailed planner to organize your writing projects and deadlines.,"Stay on track with our Writing Planner – detailed, organized, and perfect for managing your writing projects. Shop now and achieve your writing goals!",writing
Garden Cart,"A sturdy and portable cart for transporting soil, plants, and tools.","Move your garden supplies with ease using our Garden Cart – sturdy, portable, and perfect for all your gardening needs. Shop now and make gardening more efficient!",garden
Pickup Truck,"A rugged and versatile truck built for heavy-duty tasks, offering unmatched durability and towing capacity",Tackle any challenge with our Pickup Truck – strength and reliability you can count on!,cars
Decorative Throw Pillows,Stylish and comfortable pillows in various colors and patterns to add a pop of color and texture to your sofa.,Refresh your space with our Decorative Throw Pillows – comfort meets style!,kitchen
Cat Litter Box,A spacious and odor-control litter box for your cat's hygiene.,"Keep your home fresh with our Cat Litter Box – spacious, odor-control, and perfect for your cat's needs. Shop now and maintain a clean environment!",pets
Garden Pruner,A sharp and durable pruner for trimming plants and shrubs.,"Keep your plants in shape with our Garden Pruner – sharp, durable, and perfect for precise trimming. Shop now and make pruning easy!",garden
Racing Wheel,A steering wheel and pedal set for realistic racing game experiences.,"Feel the thrill of the race with our Racing Wheel – realistic, responsive, and perfect for racing games. Shop now and take the wheel!",gaming
Tesla,A fully electric sedan with a sleek design autopilot features and a long-range battery.,Drive into the future with cutting-edge electric technology.,cars
Plywood Sheets,High-quality plywood sheets for construction and furniture making.,"Construct with precision using our Plywood Sheets – strong, versatile, and perfect for building and crafting. Shop now and bring your projects to life!",construction
Rice Cooker,"An appliance that cooks rice perfectly every time, with settings for different types of rice and grains",Perfect rice made easy with our Rice Cooker – set it and forget it!,kitchen
Vacuum Cleaner,A powerful and efficient vacuum for cleaning floors and carpets.,"Keep your floors clean with our Vacuum Cleaner – powerful, efficient, and perfect for all floor types. Shop now and enjoy a dust-free home!",cleaning
Car Tire Inflator,A portable inflator for maintaining proper tire pressure on the go.,"Keep your tires in check with our Car Tire Inflator – portable, easy to use, and perfect for maintaining proper tire pressure. Shop now and drive safely!",automotive
Fruit-Filled Bonbons,"Soft, chewy candies with a burst of fruity filling in the center, available in a variety of flavors.","Discover a fruity surprise with our Fruit-Filled Bonbons – chewy, juicy, and delightful!",food
